keyword,intent,template,primary_affiliate,secondary_affiliate,status
best ai writing tools for bloggers,commercial,listicle,writesonic,semrush,failed
jasper ai vs writesonic,commercial,comparison,writesonic,semrush,failed
claude ai review 2026,commercial,review,semrush,notion,pending
best ai tools for solopreneurs,commercial,listicle,notion,writesonic,pending
chatgpt vs claude for writing,commercial,comparison,writesonic,semrush,pending
best ai seo tools 2026,commercial,listicle,semrush,surfer_seo,pending
surfer seo review,commercial,review,surfer_seo,semrush,pending
how to use claude ai for content marketing,informational,tutorial,writesonic,notion,pending
ai tools for freelance writers,commercial,listicle,writesonic,notion,pending
best ai tools for email marketing,commercial,listicle,getresponse,writesonic,pending
writesonic review 2026,commercial,review,writesonic,semrush,pending
notion ai review,commercial,review,notion,writesonic,pending
best ai tools for productivity 2026,commercial,listicle,notion,writesonic,pending
how to automate content creation with ai,informational,tutorial,writesonic,semrush,pending
jasper ai alternatives,commercial,comparison,writesonic,notion,pending
best ai tools for small business,commercial,listicle,semrush,notion,pending
ai content writing tools comparison,commercial,comparison,writesonic,surfer_seo,pending
how to use ai for seo 2026,informational,tutorial,semrush,surfer_seo,pending
best ai tools for marketing agencies,commercial,listicle,semrush,writesonic,pending
chatgpt alternatives for business,commercial,comparison,writesonic,notion,pending
getresponse review 2026,commercial,review,getresponse,writesonic,pending
best ai email marketing tools,commercial,listicle,getresponse,notion,pending
ai tools for content creators,commercial,listicle,writesonic,semrush,pending
how to use notion ai for project management,informational,tutorial,notion,writesonic,pending
best ai tools for real estate agents,commercial,listicle,notion,semrush,pending
ai writing assistant comparison 2026,commercial,comparison,writesonic,surfer_seo,pending
semrush vs ahrefs 2026,commercial,comparison,semrush,surfer_seo,pending
best ai research tools,commercial,listicle,semrush,notion,pending
how to write better with ai tools,informational,tutorial,writesonic,notion,pending
best ai tools for lawyers,commercial,listicle,notion,semrush,pending
ai tools for financial advisors,commercial,listicle,notion,getresponse,pending
claude api use cases for business,informational,tutorial,semrush,notion,pending
best ai tools for e-commerce,commercial,listicle,semrush,getresponse,pending
writesonic vs jasper ai,commercial,comparison,writesonic,semrush,pending
how to do keyword research with ai,informational,tutorial,semrush,surfer_seo,pending
best ai tools for healthcare professionals,commercial,listicle,notion,semrush,pending
notion ai vs microsoft copilot,commercial,comparison,notion,semrush,pending
ai tools for accountants,commercial,listicle,notion,getresponse,pending
best productivity apps with ai 2026,commercial,listicle,notion,writesonic,pending
how to use ai for lead generation,informational,tutorial,semrush,getresponse,pending
ai tools for hr professionals,commercial,listicle,notion,getresponse,pending
best ai tools for teachers,commercial,listicle,notion,writesonic,pending
surfer seo vs semrush,commercial,comparison,semrush,surfer_seo,pending
ai tools for customer service,commercial,listicle,getresponse,notion,pending
how to automate email marketing with ai,informational,tutorial,getresponse,writesonic,pending
best ai tools for startups,commercial,listicle,notion,semrush,pending
ai seo tools for beginners,commercial,listicle,semrush,surfer_seo,pending
how to use ai for social media marketing,informational,tutorial,writesonic,semrush,pending
best ai writing tools free,commercial,listicle,writesonic,notion,pending
ai tools for coaches and consultants,commercial,listicle,notion,getresponse,pending
